GroupID,Group Name,Group Type,Contact Name,Active,City
598,"Allstate Insurance Company Political Action Committee","Political Action Committee","Shirlanda Walker",F,"Northbrook"
600,"American Insurance Association PAC - Nevada","Political Action Committee","James L. Wadhams",F,"Sacramento"
601,"Board of Realtors Political Action Committee","Political Action Committee","Wendy DiVecchio",T,"Las Vegas"
603,"Churchill County Education Association - Together in Politics","Political Action Committee","Sue S Matuska",T,"Fallon"
607,"Carriers Allied for Responsible Government Officials","Political Action Committee","Daryl E. Capurro",F,"SPARKS"
610,"P.A.C. 357 (fka IBEW LOCAL 357 PAC)","Political Action Committee","Ronald Young",T,"Las Vegas"
615,"Building a Stronger Nevada","Political Action Committee","Frank Hawk",T,"Sacramento"
616,"Construction Industry Committee","Political Action Committee","Craig Madole",T,"Reno"
617,"Douglas County Professional Education Association Together in Politics","Political Action Committee","Sue S Matuska",T,"GARDNERVILLE"
621,"International Union of Painters and Allied Trades Political Action Together Political Committee","Political Action Committee","Jason Lamberth",T,"Hanover"
623,"Incline Village Realtors PAC","Political Action Committee","Kendra Murray",T,"Incline Village"
625,"Lincoln County Education Association TIP","Political Action Committee","Sue S Matuska",F,"Panaca"
631,"Lyon County Education Association - TIP","Political Action Committee","Sue Matuska",T,"Fernley"
632,"Plumbers & Pipefitters Local 525 PAC","Political Action Committee","Matt Lydon",T,"Las Vegas"
633,"Northern Nevada PAC","Political Action Committee","",F,"Reno"
635,"Nevada Medical Political Action Committee (NEMPAC)","Political Action Committee","Sarah Watkins",T,"Reno"
636,"Nevada Credit Union League Political Action Committee","Political Action Committee","Sue Longson",T,"Boulder City"
637,"Nevada Optometric PAC","Political Action Committee","Terri Ogden",T,"Sparks"
638,"Nevada Restaurant Association","Political Action Committee","Rodney Scott Olson",F,"Las Vegas"
639,"Nevada Faculty Alliance PAC","Political Action Committee","Sue Matuska",T,"Las Vegas"
640,"Nevada State Education Association - Together in Politics","Political Action Committee","Sue S Matuska",T,"LAS VEGAS"
641,"Nevada State AFL-CIO","Political Action Committee","Raymond McAllister",T,"Henderson"
642,"Nevada Dental Association PAC","Political Action Committee","Michele Reeder",T,"CARSON CITY"
649,"Ophthalmic Political Action Corporation","Political Action Committee","Adam Rovit, MD",F,"Las Vegas"
650,"Political Educational Fund of the Building & Construction Trades Department","Political Action Committee","Paul McKenzie",F,"Washington"
653,"NVRPAC","Political Action Committee","Tiffany Banks",T,"Reno"
654,"Roofers' Political Education and Legislative Fund","Political Action Committee","Modesto Gaxiola",F,"Washington"
663,"Washoe County Teachers Association","Political Action Committee","Sandra Lawrence",F,"Reno"
664,"Women's Campaign Fund","Political Action Committee","Jan Jones",F,"Washington"
666,"Rural Electric Advocates of Nevada","Political Action Committee","Carolyn Turner",T,"Carson City"
668,"Nevada Mining Association Political Action Committee","Political Action Committee","Tyre Gray",T,"RENO"
672,"SNR PAC","Political Action Committee","Heather Lunsford",F,"Carson City"
675,"R PAC     ""Rural PAC""","Political Action Committee","Debbie Cahill",F,"Reno"
676,"Humboldt County Classroom Teachers Association TIP  (HCCTA TIP)","Political Action Committee","Sandra Lawrence",F,"WINNEMUCCA"
680,"Nevada Concerned Citizens","Political Action Committee","Richard Ziser",F,"Las Vegas"
688,"CREPAC","Political Action Committee","Katrina Bruce",T,"Las Vegas"
689,"Storey County Education Association - TIP","Political Action Committee","Sue S Matuska",F,"Carson City"
690,"Operating Engineers Local Union #3 District 11 PAC","Political Action Committee","Steve Ingersoll",T,"Concord"
691,"Ormsby County Education Association TIP","Political Action Committee","Sue S. Matuska",T,"Carson City"
694,"Education Support Employees Association TIP","Political Action Committee","Sue S Matuska",T,"Las Vegas"
695,"Elko County Classroom Teachers Association - TIP","Political Action Committee","Sue S Matuska",T,"Elko"
697,"EMILY's List - NV","Political Action Committee","Emily Campbell",T,"Washington"
698,"Assembly Republican Caucus PAC","Political Action Committee","Kevin Magee",T,"Las Vegas"
699,"DOCPAC of Nevada","Political Action Committee","Hi V. Jeppson",F,"Napa"
700,"Citizens for Justice","Political Action Committee","Graham Galloway",T,"Carson City"
701,"Nevada NOW","Political Action Committee","Jeri Burton",T,"Las Vegas"
704,"Service Employees International","Political Action Committee","Adair Dammann",F,"Washington"
706,"Citizens for Private Enterprise ISUPAC","Political Action Committee","David L. Howard",F,"Reno"
709,"Coca-Cola Refreshments USA, Inc. Nonpartisan Political Action Committee","Political Action Committee","Shane Glisan",F,"Atlanta"
711,"Homeowners Against Discrimination in Taxes","Political Action Committee","Michael Lynch",F,"Reno"
714,"WHITE PINE SUPPORT STAFF ORGANIZATION - TIP","Political Action Committee","Karen Wilson",F,"Ely"
716,"Yes, Yes for Kids    (inactive)","Political Action Committee","Michael S. Lynch",F,"Reno"
718,"Nevada Automotive Wholesalers' Association Political Action Committee","Political Action Committee","Dave Finley",F,"Rancho Cordova"
719,"Nevada 1st PAC","Political Action Committee","David Nelson",T,"Gardnerville"
720,"Nevada Organization of Growth Opponents","Political Action Committee","William S. Hamma",F,"Reno"
724,"ARAMARK PAC","Political Action Committee","Mark M. Haley",F,"Philadelphia"
725,"LIUNA PAC","Political Action Committee","Eloy Jara",T,"Reno"
728,"Home Building Political Action Committee","Political Action Committee","Holly Nostro",T,"Las Vegas"
730,"Las Vegas Firefighters Local 1285","Political Action Committee","Cynthia Reveles",T,"Las Vegas"
736,"DLCC Nevada","Political Action Committee","Bradley Schrager",F,"Washington"
738,"Keystone Corporation","Political Action Committee","Saltzman Mugan Dushoff, PLLC",T,"Las Vegas"
741,"Nevada Society of CPAs PAC","Political Action Committee","Sharon Uithoven",F,"Reno"
744,"Sheet Metal Workers #88 PAC","Political Action Committee","Geremiah Robnett",T,"Las Vegas"
745,"Wells Fargo Bank Nevada State PAC","Political Action Committee","Merrie Linfoot",F,"Las Vegas"
746,"United Food and Commercial Workers Active Ballot Club","Political Action Committee","Mike Gittings",T,"Washington"
755,"The Big Elephant Club","Political Action Committee","George E. Harris",T,"Las Vegas"
756,"Nevada Beer Wholesalers PAC","Political Action Committee","Lewis Roca Rothgerber Christie",T,"Reno"
760,"National Federation of Independent Business Nevada Political Action Committee","Political Action Committee","Randi Thompson",F,"Washington"
762,"3M Company PAC  (fka Minnesota Mining and Manufacturing)","Political Action Committee","Eric Dornak",F,"St Paul"
764,"LVCEA-PAC","Political Action Committee","DeAndre Caruthers",T,"Las Vegas"
769,"It's a Matter of Trust","PAC Ballot Advocacy Group","John F Wiles",F,"Boulder City"
772,"PROPAC","Political Action Committee","Paul R Brown",F,"Las Vegas"
773,"Nevada Bankers Association","Political Action Committee","Phyllis Gurgevich",T,"LAS VEGAS"
776,"SBC Nevada Employee PAC","Political Action Committee","Kris Wells",F,"Reno"
777,"Nevada Contractors Association","Political Action Committee","Sean Stewart",F,"Las Vegas"
778,"Nevada Auto Dealers Election Action Committee  (NADEAC)","Political Action Committee","Andrew J. MacKay",T,"Reno"
779,"Take the State","Political Action Committee","James F. Clark",F,"Incline Village"
780,"Victory 98 PAC","Political Action Committee","Lindsey Jydstrup",F,"Las Vegas"
781,"Nevada Physical Therapy PAC","Political Action Committee","Susan Priestman",F,"Las Vegas"
784,"Nevada Hospital Association HealthPAC","Political Action Committee","Patrick D. Kelly",T,"Reno"
787,"Building and Construction Trades Council of No NV COPE","Political Action Committee","Robert Benner",T,"Sparks"
788,"Sunrise Healthcare System Good Government PAC Fund","Political Action Committee","William Ziesmer",F,"Las Vegas"
789,"Southern California-Nevada Regional Council of Carpenters","Political Action Committee","Fredrick L. Wilkening",F,"Las Vegas"
790,"NAIFA Nevada","Political Action Committee","John Messina",T,"Las Vegas"
792,"ABC Southern Nevada PAC","Political Action Committee","Jeremy J. Nork",F,"Las Vegas"
793,"Southern Nevada Concrete & Aggregates Association PAC","Political Action Committee","Greta Morrell",T,"HENDERSON"
794,"SNEA Political Information Committee","Political Action Committee","Robert J. Gagnier",F,"Carson City"
797,"White Pine Association of Classroom Teachers TIP","Political Action Committee","Sue S Matuska",T,"Ely"
798,"Carson Build PAC","Political Action Committee","Aaron West",F,"Carson City"
799,"ABC Sierra Nevada PAC","Political Action Committee","",F,"Sparks"
800,"INTERNATIONAL ASSOC OF FIRE FI","Political Action Committee","William C. Webster, Jr.",F,"Washington"
801,"IBEW Local 357 PAC","Political Action Committee","Roy Kimball",F,"Las Vegas"
804,"Elko County REALTORS Political Action Committee (ECRPAC)","Political Action Committee","Denise Taylor",T,"Elko"
805,"Reno Fire Fighters Association","Political Action Committee","Ken McLellan",T,"RENO"
808,"AGC PAC","Political Action Committee","Craig Mandole",T,"Reno"
812,"Clark County Education Association - TIP","Political Action Committee","Steve Sorensen",T,"Las Vegas"
813,"Democratic Senate Leadership PAC","Political Action Committee","Dina Titus",F,"Las Vegas"
815,"IATSE 720 Legislative Co","Political Action Committee","Michael A. Urban",F,"Las Vegas"
821,"UAW Region 6 Western States PAC","Political Action Committee","Larry Wilson",T,"Pico Rivera"
823,"Kennecott PAC","Political Action Committee","J. William McNulty, Esq",F,"Salt Lake City"
826,"Farmers Employees & Agents Nevada PAC","Political Action Committee","Rick Schnider",T,"Las Vegas"
827,"Clark County Fire Fighters Local 1908 PAC","Political Action Committee","Ron Atiyeh",T,"Las Vegas"
830,"Nevada Independent Voters","Political Action Committee","Carter R King",F,"Reno"
835,"Bank of America Nevada PAC","Political Action Committee","",F,"CHARLOTTE"
836,"Nevada Subcontractors Association (NSA PAC)","Political Action Committee","Shumway Van",T,"LAS VEGAS"
837,"Citigroup Inc. PAC - State  (Citi PAC-State)","Political Action Committee","Barbara Mulholland",F,"Washington"
839,"Silver State Leadership Alliance","Political Action Committee","Richard Perkins",F,"Las Vegas"
842,"Coalition for the Protection of Marriage","Political Action Committee","Albright Stoddard Warnick Albr",F,"Las Vegas"
843,"Dairy Farmers of America-Dairy Educational PAC","Political Action Committee","Albert Trace",F,"Corona"
846,"CROWN POLITICAL ACTION COMMITTEE","Political Action Committee","David Olmedo",F,"Boise"
850,"The Nevada Victory Fund","Political Action Committee","Paul Grace",F,"Reno"
853,"Citizens for Accountable and Responsible Elections","Political Action Committee","Lee Wayne Haynes",F,"Boulder City"
856,"Citizens and Taxpayers PAC-Nevada","Political Action Committee","Susan M. Reaser",F,"Miami"
857,"Democrat Republican Independent Voter Education","Political Action Committee","Mark Shumar",F,"Washington"
865,"Millenium Assembly Leadership Fund","Political Action Committee","Barbara Buckley",F,"Las Vegas"
869,"Political Action for Candidate Election (PACE) Nevada","Political Action Committee","Mark Nichols",F,"Las Vegas"
870,"Nevada Resort Association PAC   (inactive)","Political Action Committee","Matthew M Griffin",F,"Las Vegas"
871,"Equal Rights Nevada","Political Action Committee","Elizabeth Moore",F,"LAS VEGAS"
873,"Nevada Victory 2000","Political Action Committee","Lindsey Jydstrup",F,"Las Vegas"
875,"Peace Officers Research Association of Nevada","Political Action Committee","Tim Ross",F,"Reno"
885,"Southern Nevada Elevator Constructors Political Action Fund","Political Action Committee","Mario Vicchiullo",F,"Las Vegas"
887,"Wyeth Good Government Fund","Political Action Committee","James A. Ferguson",F,"Madison"
889,"Republican Legislators Joint Caucus","Political Action Committee","Bob Beers",F,"Las Vegas"
895,"CLARK COUNTY NSEA-TIP COORDINATING COUNCIL","Political Action Committee","Robert Broniecki",F,"Las Vegas"
904,"Informed Citizens for Quality Government","Political Action Committee","Robert W Shively",F,"Mesquite"
907,"Nevada Business Coalition","Political Action Committee","paracorp incorporated",F,"Las Vegas"
908,"Enterprise Mobility Political Action Committee","Political Action Committee","John Bernier",T,"St Louis"
910,"Duke Energy Corporation PAC","Political Action Committee","Robert Campbell",F,"Charlotte"
911,"Glaziers Union Local 2001 PAC","Political Action Committee","Jason Lamberth",F,"Henderson"
914,"Mirant Corporation PAC","Political Action Committee","Greg Weber",F,"Atlanta"
916,"Sustainable Growth Committee","Political Action Committee","Judith Kohz",F,"Minden"
917,"Verizon Communications Inc Good Government Club","Political Action Committee","Karen A. Peterson",F,"Sacramento"
920,"Kindred Healthcare Inc., PAC","Political Action Committee","Sieglinde Donohue",F,"Louisville"
921,"Bristlecone PAC","Political Action Committee","Dina Titus",F,"Henderson"
933,"Nevada Conservation League   (not active)","Political Action Committee","April Mastroluca",F,"Las Vegas"
934,"ACME Enterprises PAC","Political Action Committee","Mark H. Fiorentino",T,"Las Vegas"
936,"Citizens for Good Government","Political Action Committee","James Bradshaw",F,"Carson City"
938,"Citizens for Henderson Neighborhood Libraries","Political Action Committee","",F,"Henderson"
946,"MedPAC #566","Political Action Committee","Janice Poblete",F,"Las Vegas"
948,"Citizens for Responsible Government PAC","Political Action Committee","John Sanford",T,"Las Vegas"
949,"Nevada Correctional Peace Officer PAC","Political Action Committee","Walter R. Tarantino",F,"Carson City"
953,"Republican Women of Nevada","Political Action Committee","Dan Burdish",F,"Las Vegas"
954,"Citizens for Leadership","Political Action Committee","Mark Smith",F,"LAS VEGAS"
956,"Republican Assembly Leadership Caucus","Political Action Committee","Eric Roberts",F,"Las Vegas"
962,"Las Vegas Service Trades Council","Political Action Committee","Deanna Leivas",T,"Las Vegas"
963,"Washoe County Democratic Women's Club","Political Action Committee","Martha B. Gould",F,"Reno"
965,"Nevada Psychiatric Association","Political Action Committee","Lesley R. Dickson, MD",T,"Las Vegas"
967,"Nevada Chiropractic Association  (NCA)","Political Action Committee","Derek T Day, D.C.",F,"N Las Vegas"
969,"Keep Our Doctors in Nevada","Political Action Committee","Rudy R Manthei D.O.",F,"Henderson"
970,"United Nevada","Political Action Committee","Brett Scolari",F,"Reno"
972,"Fortis PAC","Political Action Committee","Dale Fratianne",F,"Milwaukee"
973,"CRC PAC","Political Action Committee","Tony Dane",F,"Las Vegas"
978,"Silver State Leadership Fund","Political Action Committee","Dave Turner",F,"Reno"
979,"Nevada Political Action For Animals","Political Action Committee","Vernon Weir",F,"Las Vegas"
980,"Carson City Democratic Women","Political Action Committee","Barbara T LeBlanc",T,"Carson City"
981,"The Committee to Keep Nevada Respectable","Political Action Committee","Sean Fellows",F,"Las Vegas"
982,"NRA Political Victory Fund","Political Action Committee","Greg Ferrante",T,"Fairfax"
983,"T.W.P.","Political Action Committee","T. James Truman",F,"Las Vegas"
985,"Nevada Soft Drink Association","Political Action Committee","L and R Service Company of Nevada,",F,"Reno"
987,"Bank of America Corporation State and Federal Political Action Committee","Political Action Committee","Steven L McCracken",T,"Wilmington"
988,"United Food & Commercial Workers Local 711","Political Action Committee","Michael Gittings",T,"Las Vegas"
994,"United Nevada Leadership Fund","Political Action Committee","Kyle J. Stephens",F,"Las Vegas"
996,"American Resort Development As","Political Action Committee","Karen Dennison Esq",F,"Washington"
998,"IMPACTO","Political Action Committee","Otto Merida",F,"Las Vegas"
1000,"Citizens for Ethics in Politics","Political Action Committee","Lisa Mayo-Deriso",F,"Las Vegas"
1004,"Harley-Davidson PAC of Nevada","Political Action Committee","Elizabeth Baker",T,"Milwaukee"
1005,"Cingular Wireless LLC Employee PAC","Political Action Committee","James Jackson Esq",F,"Atlanta"
1006,"Clark County OB/GYN PAC","Political Action Committee","Michael L. Peters",F,"Las Vegas"
1009,"Laborers Political League","Political Action Committee","Thomas A Morley",F,"Las Vegas"
1010,"Queenstake Jerritt Canyon Employee","Political Action Committee","Paul Dyer",F,"Elko"
1013,"Southwestern Employers PAC","Political Action Committee","Laura Billman",F,"Pahrump"
1014,"Nevadans for Sound Government","Political Action Committee","George Harris",T,"Las Vegas"
1015,"Nevada Republic Alliance","Political Action Committee","Michael Kinney",T,"Reno"
1016,"Truckee Meadows Democratic Alliance","Political Action Committee","O''Neill Sanders",F,"Reno"
1017,"National Organization for the Reform of Marijuana Laws PAC","Political Action Committee","Nancy Lord Johnson Esq",F,"Washington"
1021,"EUREKA COUNTY TEACHERS ASSOCIA  (inactive)","Political Action Committee","Sandra Lawrence",F,"Eureka"
1024,"Education First Initiative","PAC Ballot Advocacy Group","Diane Sherman",F,"Reno"
1025,"LEGISLATIVE BUSINESS PAC - ANN O'CONNELL","Political Action Committee","Ann OConnell",F,"Las Vegas"
1026,"The Speakers Outreach Program","Political Action Committee","James L. Burns",F,"Las Vegas"
1027,"Securities Rules and Regulations PAC","Political Action Committee","Mark DeStefano",F,"Las Vegas"
1028,"Nevada Psychological Association PAC","Political Action Committee","Wendi H O'Connor",T,"Las Vegas"
1032,"MBNA Corporation Federal Political Committee","Political Action Committee","John P. Sande III",F,"Wilmington"
1033,"Nevada State Association of Health Underwriters Political Action Committee","Political Action Committee","Dwight M. Mazzone",F,"Las Vegas"
1034,"Committee to Regulate and Control Marijuana CRCM","Political Action Committee","Laurence Sandell",F,"Las Vegas"
1035,"Democratic Party of Washoe County","Political Party Committee","Bruce Comer",T,"Reno"
1036,"Builders Association of Northern Nevada   (BANN-PAC)","Political Action Committee","Dan Morgan",T,"Reno"
1037,"Nye County Classroom Teachers Association TIP","Political Action Committee","Sue S Matuska",T,"Pahrump"
1040,"International Union of Operating Engineers, Stationary Engineers Local No. 39 Nevada PAC","Political Action Committee","Jerry Frederick",F,"San Francisco"
1047,"AMERICAN FEDERATION OF STATE, COUNTY AND MUNICIPAL EMPLOYEES, AFL-CIO","Political Action Committee","Monna Miller",F,"Washington"
1048,"AMERICAN VETERANS ADVISORY GROUP","Political Action Committee","Brian H. Broadus",F,"Las Vegas"
1050,"AngloGold Employee Committee for Effective Nevada Government","Political Action Committee","Greg Struble",F,"Greenwood Village"
1054,"BORPAC COMMITTEE","Political Action Committee","Hazelmae M. Tipton",F,"Fallon"
1065,"Citizens Against Service Taxes   (""CAST"")","Political Action Committee","Kemp Jones & Coulthard, LLP",F,"Las Vegas"
1071,"Lander County Classroom Teachers Association TIP","Political Action Committee","Sue S Matuska",T,"Battle Mountain"
1081,"NEVADA DEMOCRATIC LEADERSHIP COALITION","Political Action Committee","Amy S Ayoub",F,"Las Vegas"
1093,"NEVADANS FOR CHANGE","Political Action Committee","Charles W. Ivy",F,"Las Vegas"
1102,"NHU PAC  (NEVADA ASSOCIATION OF STATE HEALTH UNDERWRITERS)","Political Action Committee","Constance Aldridge",F,"Reno"
1104,"North Las Vegas Police Officers PAC","Political Action Committee","Scott Hafen",F,"Las Vegas"
1149,"10-20-LIFE","Political Action Committee","David Humke",F,"Las Vegas"
1158,"Shlincoln PAC","Political Action Committee","Mark H Fiorentino",T,"Las Vegas"
1159,"Household International, Inc.","Political Action Committee","Steve Linder",F,"Prospect Heights"
1161,"Washoe County Sheriff's Deputies Association","Political Action Committee","Cameron Wagner",F,"Reno"
1162,"Nevadans for National Average","Political Action Committee","Debbie Cahill",F,"Las Vegas"
1164,"Smaxy PAC","Political Action Committee","Mark H. Fiorentino",T,"Las Vegas"
1165,"Committee for Truth In Politics","Political Action Committee","Doug Roundy",F,"Las Vegas"
1166,"NevadaCare PAC","Political Action Committee","John Murtha",F,"Las Vegas"
1168,"Democracy For Nevada","Political Action Committee","Matthew J Dickson",F,"Sparks"
1169,"S.A.F.E. PAC","Political Action Committee","Felix P. Lockwood",F,"Minden"
1171,"ARDA ROC-PAC","Political Action Committee","Tia White",T,"Washington"
1173,"America Coming Together - Neva","Political Action Committee","Terence Tolbert",F,"Washington D.C."
1174,"White Rabbit PAC","Political Action Committee","Jake McNeill",T,"Reno"
1175,"Sierra Nevada REALTORS Political Action Committee","Political Action Committee","April LaBrie",T,"Reno"
1176,"Nevada Tavern Owners Association PAC","Political Action Committee","Rodney Scott Olson",F,"Las Vegas"
1177,"NEA Fund for Children and Public Education","Political Action Committee","Sue Matuska",T,"Washington"
1178,"ING America Insurance Holdings","Political Action Committee","Tara Hagan",F,"Windsor"
1180,"Douglas County Democratic Women","Political Action Committee","Katherine K. Godbey",T,"Minden"
1181,"Douglas County Democratic Central Committee","Political Party Committee","Deni Caster",T,"Minden"
1182,"CWA - Committee on Political Education","Political Action Committee","Marc Ellis",T,"Washington"
1183,"Community Pride Fund","Political Action Committee","Jim Bilbray",F,"Arlington"
1185,"Nevadans For Freedom of Choice","Political Action Committee","Patricia D Cafferata",F,"Reno"
1187,"Citizens for Fair Taxation","Political Action Committee","Michael Alonso",F,"Las Vegas"
1188,"Coalition for Legislative Integrity","Political Action Committee","Michael Alonso",F,"Las Vegas"
1189,"Legislative Watch","Political Action Committee","Michael Alonso",F,"Las Vegas"
1191,"Coalition to Keep Brothels Out of Churchill County","Political Action Committee","Alan J. Perazzo",F,"Fallon"
1192,"Nevada Justice PAC","Political Action Committee","Helen Margulis",F,"Henderson"
1195,"Nevada Health Care Association Quality First Political Action Committee  (NHCA Quality First - PAC)","Political Action Committee","Kevin Benson",F,"Henderson"
1196,"Nevada State Medical Association","PAC Ballot Advocacy Group","",F,"Reno"
1197,"Sustainable Growth Initiative   (inactive)","PAC Ballot Advocacy Group","",F,"Gardnerville"
1198,"Yes on Question 6","Political Action Committee","Gail Tuzzolo",F,"Carson City"
1199,"Alrus Consulting","PAC Ballot Advocacy Group","",F,"Reno"
1200,"Yes on Questions 4 and 5","Political Action Committee","Beverly Salhanick Esq",F,"Las Vegas"
1201,"Libertarian Party of Nevada","Political Party Committee","",F,"Las Vegas"
1204,"Nevada Taxpayers Association","PAC Ballot Advocacy Group","Carol Vilardo",F,"Carson City"
1205,"Assembly Democratic Caucus","Political Party Committee","",T,"LAS VEGAS"
1206,"Nevadans Against Frivolous Lawsuits","PAC Ballot Advocacy Group","",F,"Las Vegas"
1207,"Nevada Republican State Central Committee","Political Party Committee","",F,"Las Vegas"
1208,"Clark County Democratic Party","Political Party Committee","Joseph Throneberry",T,"LAS VEGAS"
1209,"Nevada State Democratic Party","Political Party Committee","Christopher Guy",T,"LAS VEGAS"
1210,"Washoe County Republican Central Committee","Political Party Committee","Patricia Miller, Treasurer",T,"Reno"
1211,"Senate Republican Leadership Conference","Political Action Committee","Heidi Gansert",T,"RENO"
1212,"Democratic Legislative Caucus","Political Party Committee","",F,"Las Vegas"
1213,"Lyon County Republican Central Committee","Political Party Committee","Anita Dayton",T,"Silver Springs"
1215,"Clark County Republican Central Committee","Political Party Committee","Sally Minster",T,"LAS VEGAS"
1216,"Southern Nevada Central Council Committee on Political Education","Political Action Committee","Debra Berko",F,"Henderson"
1217,"Washoe Education Association Together in Politics","Political Action Committee","Sue S Matuska",T,"Reno"
1218,"Operating Engineers Local Union No 12 Political Fund","Political Action Committee","Shawn Kinsey",T,"Pasadena"
1220,"Culinary Workers Union Local 226","Independent Expenditure","",F,"Las Vegas"
1221,"United Food and Commercial Workers Issue Education Fund","Political Action Committee","Deborah Fortuna",F,"Buena Park"
1222,"IUOE, Stationary Engineers Local No. 39 Nevada PAC","Political Action Committee","Jerry Frederick",T,"San Francisco"
1225,"Clark County Republican Party","Political Party Committee","",F,"Las Vegas"
1226,"Sierra Nevada Republican Women","Political Action Committee","Natalie Yanish",T,"Minden"
1228,"Nevada Tobacco Prevention Coalition","PAC Ballot Advocacy Group","",F,"Reno"
1229,"Brush Engineered Materials Good Government Fund","Political Action Committee","Stefan Magyari",F,"Cleveland"
1230,"Nevada Insurance Individuals Insurance PAC (NIIPAC)","Political Action Committee","",F,"Carson City"
1231,"The Chairman's Fund","Political Action Committee","David W Turner",F,"Reno"
1232,"Citizens for Integrity","Political Action Committee","State Agent and Transfer Syndi",F,"Reno"
1233,"Democracy for America - NV","Political Action Committee","Margery Hanson",F,"Burlington"
1236,"Planned Parenthood Advocates Mar Monte Candidate PAC","Political Action Committee","Daela Gibson",F,"Sacramento"
