GroupID,Group Name,Group Type,Contact Name,Active,City
3641,"Clark County District B Community & Leadership PAC","Political Action Committee","Kami L. Dempsey-Goudie",T,"North Las Vegas"
3642,"McKesson Corporation Employees Political Fund","Political Action Committee","Chris Ferrari",F,"San Francisco"
3644,"McGuireWoods Federal PAC","Political Action Committee","",F,"Richmond"
3645,"Nevadans for Reliable, Renewable and Affordable Energy","Political Action Committee","John J. Peragallo",T,"Las Vegas"
3649,"Citizens for Better Neighborhoods","Political Action Committee","Cameron Phillips",F,"Las Vegas"
3651,"Future for Nevadans","Political Action Committee","Thomas Datwyler",T,"Las Vegas"
3652,"Nevadans for Affordable and Accessible Animal Care","Political Action Committee","Beverly Salhanick, Esq.",F,"Las Vegas"
3657,"North Las Vegas Action Network","Political Action Committee","Suken Shah",F,"North Las Vegas"
3659,"Justice, Ethics and Truth P.A.C.(inactive duplicate)","Political Action Committee","",F,"Henderson"
3661,"CITIZENS TO PRESERVE NEIGHBORHOODS","Political Action Committee","Andrew Woods",F,"Las Vegas"
3663,"Prevent Sanctuary Cities","PAC Ballot Advocacy Group","Jeremy Hughes",F,"Las Vegas"
3665,"Neal Siniakin","Political Action Committee","Neal Siniakin",F,"Boulder City"
3666,"Healthy Nevada PAC","Political Action Committee","Cameron Phillips",T,"Las Vegas"
3668,"friends of responsible growth","PAC Ballot Advocacy Group","",F,"Boulder City"
3670,"Strong Public Schools Nevada","Political Action Committee","Sue Matuska",T,"Las Vegas"
3672,"Nevada Progressive Coalition","Political Action Committee","Adam Stuart Littman",F,"Las Vegas"
3673,"Citizens for Better Communities","Political Action Committee","Chrissie Hastie",F,"Las Vegas"
3674,"Together we win PAC","Political Action Committee","Richard Bunce",F,"Henderson"
3677,"Marsy's Law for Nevada LLC","PAC Ballot Advocacy Group","Chrissie Hastie",F,"Las Vegas"
3678,"Committee to Recall Senator Joyce Woodhouse","Recall Committee","Stephen Silberkraus",F,"Henderson"
3679,"Committee to Recall Senator Patricia Farley","Recall Committee","Annalise Castor",F,"Las Vegas"
3680,"Committee to Recall Senator Nicole Cannizzaro","Recall Committee","Claire Roth",F,"Las Vegas"
3681,"Our Votes, Our Voice","Recall Committee","Bradley Schrager",F,"Washington"
3682,"THE WE2 MOVEMENT","Political Action Committee","Alexander Assefa",F,"Las Vegas"
3683,"For Nevada's Future, Against the Recall","Recall Committee","Artemisa Blanco",F,"Reno"
3685,"Washoe Residents for Appropriate Planning","Political Action Committee","Stephen Wolgast",F,"Reno"
3686,"American Integrity Project","Political Action Committee","Maria Wojciechowski, Treasurer",F,"Herndon"
3687,"Nevadans for Election Reform","Political Action Committee","Douglas E. Goodman",T,"Sparks"
3688,"National Democratic Redistricting Committee - Nevada","Political Action Committee","Bradley S. Schrager",F,"Washington"
3689,"Douglas County Repeal the Commerce Tax","PAC Ballot Advocacy Group","Lynn Muzzy",F,"Minden"
3690,"Reclaim Nevada PAC","Political Action Committee","Ryan Phillips",F,"Las Vegas"
3691,"Nevada Works","Political Action Committee","Merritt Carlton",T,"Las Vegas"
3692,"NEA Fund for Children and Public Education Non-Federal Unitemized Account","Political Action Committee","Sue S. Matuska",T,"Washington"
3694,"NV First","Political Action Committee","Heidi Gansert",T,"Reno"
3695,"Freedom Partners Action Fund, Inc.","Political Action Committee","Thomas F. Maxwell III",F,"Arlington"
3697,"Let America Vote Nevada","Political Action Committee","Lili Snyder",F,"Washington"
3699,"DNC PAC","Political Action Committee","Thomas White",T,"Las Vegas"
3700,"Light of Freedom PAC","PAC Ballot Advocacy Group","Bradley Schrager",F,"Las Vegas"
3701,"Nevadans For Innovation","Political Action Committee","Christopher Grove",F,"Las Vegas"
3702,"ColorOfChange PAC","Political Action Committee","Patrina McKinney",F,"Oakland"
3703,"All For Our Country Leadership PAC","Political Action Committee","Lili Snyder",T,"Washington"
3704,"Nevada Green Party","Political Party Committee","",F,"Las Vegas"
3707,"Sapphire Leadership Political Action Committee","Political Action Committee","Gary Fisher",T,"North Las Vegas"
3708,"Coalition to Defeat Question 3","Political Action Committee","Daniel Bravo",F,"Las Vegas"
3709,"Nevadans for a Clean Energy Future","PAC Ballot Advocacy Group","Steve Mele",F,"Carson City"
3711,"Leadership with Integrity","Political Action Committee","Osvaldo Fumo",F,"Las Vegas"
3712,"Citizens for a Stronger Government","Political Action Committee","Matthew Yarbrough",F,"Las Vegas"
3715,"American Society of Anesthesiologists Political Action Committee","Political Action Committee","Dean Polce",T,"Schaumburg"
3718,"Recovery PAC","Political Action Committee","Garrett Hade",T,"Las Vegas"
3720,"Nevada Families First","Political Action Committee","Ashley Sulewski",F,"Henderson"
3722,"Sheet Metal Workers Local Union 26 PAC","Political Action Committee","James Dillard",F,"Sacramento"
3723,"Battle Born Conservative Women","Political Action Committee","Matthew Yarbrough",F,"Henderson"
3724,"Protect Nevada Women","Political Action Committee","Maya S. Holmes",F,"New York"
3727,"End Trafficking and Prostitution (ETAP)","Political Action Committee","Jason D. Guinasso, Esq.",T,"Reno"
3728,"Sierra Medical Political Action Committee (SIMPAC)","Political Action Committee","Lyn Beggs, Esq.",F,"Reno"
3729,"Brighter Future For Nevada","Political Action Committee","Daniel Stewart",F,"Las Vegas"
3730,"Battle Born Women PAC","Political Action Committee","Alex Bacchus",T,"Reno"
3732,"Liberty Mutual Insurance Company - PAC","Political Action Committee","Jeanette Belz",T,"Boston"
3733,"Humane Nevada","Political Action Committee","Jeff Dixon",F,"LAS VEGAS"
3734,"SAVE LIVES NEVADA","Political Action Committee","Andrew Woods",F,"Las Vegas"
3736,"Nevada Priorities","Political Action Committee","Judith Argao",F,"Washington"
3737,"Nevada Taxpayers Coalition","Political Action Committee","Chrissie Hastie",F,"Las Vegas"
3738,"Giffords PAC Nevada","Political Action Committee","Emily Campbell",F,"Washington"
3741,"Nevada Law & Justice PAC","Political Action Committee","Whitney Tymas, Treasurer",F,"Washington"
3742,"Reno Renewed","Political Action Committee","Robert Uithoven",F,"Reno"
3744,"Win Justice","Political Action Committee","Incorp Services, Inc.",F,"Washington"
3745,"iVote Nevada","Political Action Committee","Lili Snyder",F,"Washington"
3746,"Win at the Door PAC","Political Action Committee","Shana Weir",F,"Las Vegas"
3747,"Citizens for Clean Government","Political Action Committee","Chrissie Hastie",F,"Las Vegas"
3748,"Nevada Progressives United PAC","Political Action Committee","Thomas White",T,"Las Vegas"
3749,"For Our Future","Political Action Committee","Gariety Pruitt",T,"WASHINGTON"
3750,"Nevada Conservation League Ballot Initiative Political Action Committee","PAC Ballot Advocacy Group","Andrew Maggi",F,"Las Vegas"
3753,"Nevada Action PAC","Political Action Committee","James T Hampton II",F,"Las Vegas"
3754,"MoveOn.org Political Action","Political Action Committee","Jordan Butler",F,"Beaverton"
3756,"Nevadans For Secure Elections","Non-Profit Corporation","Ellen Kurz",F,"Carson City"
3757,"Building a Stronger Nevada - Inactivated","Political Action Committee","Joshua J. Hicks",F,"Reno"
3758,"SEIU Local 1107","Political Action Committee","Brian Sheperd",T,"Sacramento"
3759,"AFSCME Nevada","Political Action Committee","Harry Schiffman",T,"Washington"
3761,"DAGA Nevada","Political Action Committee","Frankie Sue Del Papa",F,"Washington"
3762,"Battle Born and Raised Leadership","Political Action Committee","Nicole Cannizzaro",T,"LAS VEGAS"
3763,"Nevada Women's Lobby","Political Action Committee","Doris Dowden",F,"Reno"
3764,"International Brotherhood of Electrical Workers Nevada PAC (IBEW NV PAC)","Political Action Committee","David Jones",T,"Washington"
3765,"Stop Truckee River Flooding Coalition","PAC Ballot Advocacy Group","Christopher Carson",F,"Reno"
4765,"BE THE CHANGE PAC","Political Action Committee","Chris Giunchigliani",T,"Las Vegas"
4766,"OUR UNITED RESOURCE PAC","Political Action Committee","Erma McDowell",T,"RENO"
4768,"Nevada Republican Feminists (NRF)","Political Action Committee","L. Kassee Bulen",F,"Las Vegas"
4769,"Winning PAC","Political Action Committee","Yvanna Cancela",F,"Las Vegas"
4770,"5 for Fernley PAC","PAC Ballot Advocacy Group","Kelly  Brye",F,"Fernley"
4772,"NROC LPL EDU","Political Action Committee","Thomas White",T,"Seattle"
4773,"Panish / Shea / Boyle / Ravipudi LLP","Political Action Committee","Adam Ellis",T,"Los Angeles"
4774,"State Victory Action","Political Action Committee","Jordan Butler",F,"Raleigh"
4776,"Citizens for Responsible County and Local Government","Political Action Committee","Rudy Viola",F,"RENO"
4777,"DON'T CALIFORNIA OUR NEVADA","Political Action Committee","Heather Perugino",F,"Las Vegas"
4779,"Fox Rothschild LLP PAC","Political Action Committee","Mark J. Connot",F,"Philadelphia"
4780,"Common Good VA","Political Action Committee","I. Scott Bogatz",F,"Arlington"
4782,"OPCMIA Local 797 PAC","Political Action Committee","Marc Leavitt",T,"Las Vegas"
4784,"American Leadership Committee - Nevada","Political Action Committee","Bradley S. Schrager, Esq.",T,"Washington"
4786,"American Civil Liberties Union of Nevada, Incorporated","Non-Profit Corporation","Tod Story",T,"Las Vegas"
4787,"IBEW Political Action Committee Local 47","Political Action Committee","James Halsey",T,"SACRAMENTO"
4788,"Working People Rising","Political Action Committee","Artemisa Blanco",T,"Henderson"
4790,"Committee for the Betterment of Clark County","Political Action Committee","David Kallas",F,"Henderson"
4794,"Protect Our Winters Action Fund Independent Expenditure Committee N.P.","Non-Profit Corporation","Torrey Udall",F,"Denver"
4797,"Tides Advocacy","Non-Profit Corporation","Amanda Keton",T,"San Francisco"
4798,"Veterans for Responsible Government","Political Action Committee","Matthew Defalco",F,"Henderson"
4799,"NCRCC Nevada Citizens Rural Communities Coalition","Political Action Committee","Richard Marshall",T,"Pahrump"
4800,"Democratic Midterm Victory Fund","Political Action Committee","Daniel Bravo",F,"Los Angeles"
4801,"Democratic Association of Secretaries of State","Political Action Committee","Nellie Gorbea",F,"Los Angeles"
4803,"DAGA NV People's Lawyer Project","Political Action Committee","Aaron Pickrell",F,"Washington"
4807,"DLGA PAC - Nevada","Political Action Committee","Megan Jones",F,"Washington"
4809,"ACC Nevada PAC","Political Action Committee","Piers Tueller",F,"Washington"
4810,"Parents for Safe Schools","Political Action Committee","Melissa Clement",F,"Reno"
4811,"Americans For Prosperity Action (AFP Action, Concerned Veterans for America Action, CVA Action, The Libre Initiative","Political Action Committee","Ronald Najarro",F,"Arlington"
4813,"Protect Our Winters Action Fund Independent Expenditure Committee","Political Action Committee","John Morse CPA",F,"Denver"
4814,"NextGen Climate Action Committee - Nevada","Political Action Committee","Rachel Keen",F,"Washington"
4815,"One Apia Nevada PAC","Political Action Committee","Eric Jeng",T,"Las Vegas"
4816,"Opportunity First NV","Political Action Committee","Benjamin Challinor",F,"Washington"
4818,"Independent Nevadans PAC","Political Action Committee","William B. Conrad",F,"Reno"
4820,"PLAN Action Fund","Non-Profit Corporation","",F,"Las Vegas"
4821,"Aaron's Inc. Political Action Committee","Political Action Committee","Stephanie Kozol",F,"Atlanta"
4823,"American Possibilities Nevada PAC","Political Action Committee","Judith Zamore",F,"Washington"
4825,"Latino Victory Fund","Political Action Committee","Jose Angel Solorio",T,"Washington"
4827,"Fighting For Nevada","Political Action Committee","David McGowan",F,"Henderson"
4832,"APALA NV","Political Action Committee","Vivian Chang",F,"Las Vegas"
4833,"Human Rights Campaign Equality Votes","Political Action Committee","Karl Catarata",T,"Washington"
4835,"United Food and Commercial Workers Western States Council Independent Expenditure PAC","Political Action Committee","Michael Gittings",T,"SACRAMENTO"
4836,"Boulder City Utility Coalition Political Action Committee","Political Action Committee","Robert D. Napier",F,"Boulder City"
4837,"GET OUT THE VOTE, INC., dba TRU BLU FACTS","Political Action Committee","James F. Clark",F,"Incline Village"
4840,"Home Means Nevada","Political Action Committee","Scott Gilles",T,"Carson City"
4841,"Sisolak Inaugural Committee","Political Action Committee","Tia Dietz",F,"Carson City"
4842,"Veterans in Community","Political Action Committee","Steven Seroka",F,"Las Vegas"
4843,"Asians For Public Service","Political Action Committee","Ashok Mirchandani",F,"Las Vegas"
4844,"Ninja PAC","Political Action Committee","Jennifer Lehner",F,"Las Vegas"
4845,"Vote for Nevada","Political Action Committee","David Gibbs",F,"North Las Vegas"
4846,"No Means No, Ruben PAC","Political Action Committee","Arialle Velaochaga",F,"Henderson"
4847,"Fighting for the Future","Political Action Committee","Cameron Phillips",F,"Las Vegas"
4848,"Keep Our Doctors In NV","Political Action Committee","Rudy Manthei",F,"Henderson"
4852,"For the People","Political Action Committee","Cameron Phillips",F,"Las Vegas"
4856,"Nevada Pain Matters","Political Action Committee","Teresa Murphy",F,"Las Vegas"
4858,"Local Jobs for Nevada Working Families","Political Action Committee","Susan Martinez",T,"Henderson"
4861,"Committee to Recall Councilman Steve Seroka","Recall Committee","Joshua King",F,"Las Vegas"
4862,"Bricklayers & Allied Craftworkers Local #13 PAC Fund","Political Action Committee","Richard Crawford",T,"Las Vegas"
4863,"Lady Liberty Nevada PAC","Political Action Committee","Candy Greene",T,"Reno"
4867,"Fight For Nevada","Political Action Committee","Rudy Clai",F,"Las Vegas"
4871,"Tobacco 21 Nevada","Political Action Committee","Eric Roberts",F,"Las Vegas"
4872,"Shane Bybee Recall Committee","Recall Committee","Cheryl Noriega",F,"McGill"
4873,"V is for Victory","Political Action Committee","Cameron Phillips",T,"Las Vegas"
4874,"Evening in Nevada","Political Action Committee","William Adler",T,"Carson City"
4879,"Nevada Young Republicans PAC","Political Action Committee","Matthew Woodrow Johnston II",F,"Las Vegas"
4883,"Relentless Republicans.com","Political Action Committee","David McKeon",F,"Las Vegas"
4884,"Nevada Victory PAC","Political Action Committee","Melissa Hardy",T,"Las Vegas"
4886,"Lead Forward PAC","Political Action Committee","Kevin Magee",T,"Reno"
4887,"Warren for President, Inc.","Political Action Committee","Laura Denietolis",F,"Foxboro"
4889,"Kamala Harris for the People","Political Action Committee","Ernesto Apreza",F,"Baltimore"
4890,"Consumers for Judicial Equality","Political Action Committee","Sean Claggett",F,"Las Vegas"
4893,"Cory 2020","Political Action Committee","Philip Kim",F,"Newark"
5893,"Pete for America, Inc.","Political Action Committee","Paul Selberg",F,"South Bend"
5896,"Humboldt County 2nd Amendment Grassroots","Recall Committee","Cheree Castellanos",F,"Winnemucca"
5897,"Take Back the West","Political Action Committee","Jean Kordenbrock",F,"Las Vegas"
5899,"Nevada Can Committee","Political Action Committee","Layke Martin",T,"LAS VEGAS"
5900,"Fair Fight","Political Action Committee","Daniel Bravo",F,"Atlanta"
5903,"Fair Maps Nevada","PAC Ballot Advocacy Group","Cameron Phillips",T,"Las Vegas"
5904,"Douglas County Taxpayers Strike Force","Political Action Committee","Marshall or Anne Goldy",F,"Gardnerville"
5905,"Reagan Legacy Political Action Committee","Political Action Committee","Fred Weinberg",F,"Carson City"
5906,"International Brotherhood of Boilermakers Local 92 PAC","Political Action Committee","Librado Lalo Cervantez",T,"Sacramento"
5907,"Family Data Privacy PAC","Political Action Committee","Todd Bailey",F,"Reno"
5908,"Nevada Court Watchers PAC","Political Action Committee","David Schoen",F,"Las Vegas"
5913,"Nevada Vaping Association - Legal Fund","Political Action Committee","Alexander Mazzola",F,"Las Vegas"
5914,"Realtor Champion Political Action Committee","Political Action Committee","Tiffany Banks",T,"Reno"
5915,"Realtor Industry Political Action Committee","Political Action Committee","Tiffany Banks",T,"Reno"
6914,"Committee to Elect Stacy Rocheleau","Political Party Committee","",F,"Las Vegas"
6916,"Carson City Fire Fighters Association PAC","Political Action Committee","Kevin Nyberg",T,"Carson City"
6918,"Committee to Elect Karl Armstrong","Independent Expenditure","",F,"Las Vegas"
6919,"Committee to Elect Dustin Marcello","Political Party Committee","",F,"Las Vegas"
6920,"STRONGER NEVADA PAC","Political Action Committee","Cameron Phillips",T,"Las Vegas"
6921,"Nevadans for Fair Gaming Taxes","PAC Ballot Advocacy Group","Steven Sorensen",T,"Las Vegas"
6922,"Fund Our Schools","PAC Ballot Advocacy Group","Steven Sorensen",T,"Las Vegas"
6923,"A Better Tomorrow","Political Action Committee","Chrissie Hastie",F,"Las Vegas"
6925,"Nevadans for Higher Quality Education","PAC Ballot Advocacy Group","Bradley Schrager",T,"Las Vegas"
6926,"Douglas County 2020 PAC","Political Action Committee","Cheryl Blomstrom",F,"Carson City"
6927,"Amy for America","Political Action Committee","Marina Negroponte",F,"Minneapolis"
6928,"HCA Nevada Good Government Fund","Political Action Committee","Fred Ashworth",T,"Henderson"
6929,"Let's Get to Work Nevada","Political Action Committee","Layke Martin",T,"Las Vegas"
6930,"Committee to Elect Lisa Ortega","Independent Expenditure","",F,"Las Vegas"
6931,"Brunch in Nevada PAC","Political Action Committee","Christopher Brooks",F,"Las Vegas"
6934,"Protect Our Girls","Political Action Committee","Cameron Phillips",T,"Las Vegas"
6936,"Preserve Nevada Values PAC","Political Action Committee","Danny Tarkanian",T,"Gardnerville"
6937,"Friends of Kurt Thigpen","Non-Profit Corporation","",F,"Reno"
6939,"Committee to Submit a referendum petition for Douglas County ordinance 2016-1456","PAC Ballot Advocacy Group","David Maxwell",F,"Gardnerville"
6940,"ABC - A Better Choice for Students","Political Action Committee","Sheila Moulton",T,"LAS VEGAS"
6941,"Committee to Elect David Bagley","Independent Expenditure","",F,"Las Vegas"
6944,"Committee to Elect Carli Kierny","Independent Expenditure","",F,"Las Vegas"
6946,"Nevada Para Todos","Political Action Committee","Sandra Jauregui",T,"Las Vegas"
6947,"Make Nevada Red","Political Action Committee","Maria Achatz",F,"Las Vegas"
6951,"Southern Nevada Stronger PAC","Political Action Committee","Justin Jones",T,"LAS VEGAS"
6953,"Nevadans for Equality","PAC Ballot Advocacy Group","Steven Mele",F,"Las Vegas"
6954,"Problem Solvers","Political Action Committee","Charles Gallagher",F,"Las Vegas"
6956,"Smart Solutions for the Silver State","Political Action Committee","Steven Mele",T,"LAS VEGAS"
6957,"Expel Michele","Recall Committee","Molly Taylor",F,"Las Vegas"
6959,"Annie PAC","Political Action Committee","Annie Black",F,"Mesquite"
6960,"Douglas County Agricultural and Open Space Conservation Plan","PAC Ballot Advocacy Group","Maureen Casey",F,"Minden"
6962,"Allies for Educational Equity","Political Action Committee","Lea Crusey",F,"Washington"
6963,"Save Boulder City Airport","Political Action Committee","Matt Ragan",F,"Boulder City"
6964,"Strategic Horizons","Political Action Committee","Steve Sorensen",T,"Las Vegas"
6965,"No Mask Nevada","Political Action Committee","Ian Bayne",T,"Las Vegas"
6966,"Nevada For Liberty","Political Action Committee","Brandon Davis",F,"Las Vegas"
6967,"Law Enforcement Loyalty PAC","Political Action Committee","Sam Peters",F,"Las Vegas"
6968,"Building a Better Nevada","Political Action Committee","Michelle Mortensen",F,"Las Vegas"
6970,"Committee to Elect Briana Johnson","Independent Expenditure","",F,"NORTH LAS VEGAS"
6972,"Taylor Morrison Inc. Building Strong Business PAC","Political Action Committee","Kent Lay",T,"Scottsdale"
6974,"Starfish Leadership Fund","Political Action Committee","Ellen Spiegel",T,"Henderson"
6976,"Phony Phil","Political Action Committee","Alexander Brigandi",F,"Las Vegas"
6977,"Conservative Women's Political Action Committee","Political Action Committee","Kathleen Matson",T,"Henderson"
6979,"Nevada Muslims PAC","Political Action Committee","Athar Haseebullah",F,"Las Vegas"
6980,"Battle Born Patriots","Recall Committee","Bruce Parks",F,"Sparks"
6981,"PROGRESS & PROSPERITY PAC","Political Action Committee","Swadeep Nigam",F,"Henderson"
6982,"Female Majority PAC","Political Action Committee","Nicole Cannizzaro",T,"Las Vegas"
6983,"Care in Action, Inc.","Political Action Committee","Yadira Siqueiros",T,"New York"
6984,"Make Liberty Win","Political Action Committee","Shana Weir",F,"Alexandria"
6986,"Save Nevada - Recall Steve Sisolak","Recall Committee","Kelly Nunes",F,"Las Vegas"
6987,"State and Local PAC of the International Alliance of Theatrical Stage Employees","Political Action Committee","Marielle Thorne",T,"New York"
6988,"Nevada Conservation Leadership Political Action Committee","Political Action Committee","Paul Selberg",T,"Las Vegas"
6989,"Judge the Judges PAC","Political Action Committee","Bradley Mayer",T,"Reno"
6994,"Mesquite Police Officers Association","Political Action Committee","Wyatt Oliver",F,"Mesquite"
6995,"Educate Nevada","Political Action Committee","John J. Peragallo",F,"Las Vegas"
6997,"Protect Our Police PAC","Political Action Committee","Wes Boger",F,"Philadelphia"
6998,"The People's Champ PAC Inc.","Political Action Committee","Cameron Phillips",F,"Las Vegas"
6999,"Purpose Financial, Inc. PAC","Political Action Committee","Michael Byrne",T,"Greenville"
7000,"Yes on 1","PAC Ballot Advocacy Group","Maureen Schafer",F,"Las Vegas"
7002,"Carollo Engineers Inc. PAC","Political Action Committee","Eric Leveque",T,"Costa Mesa"
7003,"AllAroundA PAC","Political Action Committee","Mandi Karp",T,"HENDERSON"
7004,"Honest Nevada PAC","Political Action Committee","Cameron Phillips",F,"Las Vegas"
7005,"Nevada Munk PAC","Political Action Committee","Connie Munk",F,"LAS VEGAS"
7006,"Democratic Lieutenant Governors Association Nevada","Political Action Committee","Megan Jones",F,"Washington"
7007,"Marathon Petroleum Corporation Employees Political Action Committee","Political Action Committee","William Horne",F,"Findlay"
7008,"Service Corporation International PAC","Political Action Committee","Celena Dilullo",T,"Houston"
7009,"Washoe Republican Women","Political Action Committee","Barb Hawn",F,"Reno"
7011,"AEE Action Fund","Political Action Committee","Allison Ingram",F,"Washington"
7014,"Nevada Proud PAC","Political Action Committee","Michael Tanchek",T,"RENO"
7015,"The Nevada PAC","Political Action Committee","Michael B. Jack",F,"Reno"
7017,"Nevadans for Data Privacy","Political Action Committee","Lewis Feldman",F,"Zephyr Cove"
7022,"Truckee Meadows Business Coalition","Political Action Committee","Cameron Phillips",T,"Reno"
7023,"Recall Timothy Hipp","Recall Committee","Jeffery Stewart",T,"Goldfield"
7024,"Conservatives for Election Integrity","Political Action Committee","Jim Marchant",T,"Las Vegas"
7027,"Protect & Serve Nevada","Political Action Committee","Daniel Gordon",T,"Carson City"
7028,"A Safer Nevada","PAC Ballot Advocacy Group","Marc Gohres",T,"Las Vegas"
7030,"AAPI Forward","Political Action Committee","Regi Kunnel",F,"Las Vegas"
7031,"Community Schools Initiative, PACAD","PAC Ballot Advocacy Group","Cameron Phillips",T,"Henderson"
7032,"Committee to Recall Michael Chopp (LCSD Trustee)","Recall Committee","Cassandra Gunther",T,"Battle Mountain"
7033,"Committee to Recall Douglas S. Staton III (LCSD Trustee)","Recall Committee","Cassandra Gunther",T,"Battle Mountain"
9038,"Silver State Action Fund","Political Action Committee","Justin Bustos",F,"Reno"
9039,"Better Nevada PAC","Political Action Committee","Cameron Phillips",T,"Las Vegas"
9040,"Committee to Recall Linda Lee McMahon (LCSD Trustee)","Recall Committee","Cassandra Gunther",T,"Battle Mountain"
9042,"Relevant PAC","Political Action Committee","Dow Woerner",F,"Las Vegas"
9044,"Integrity for Growth & Opportunity PAC (i-GOP)","Political Action Committee","Cameron Phillips",T,"Las Vegas"
9045,"Committee to Recall Jesse Watts","Recall Committee","Ashley Adams",T,"Eureka"
9047,"Dentaquest PAC TN-C","Political Action Committee","Edward Greissing",F,"Nashville"
9049,"Committee Recall Jeannie Ybarra","Recall Committee","Edward Ringle",T,"Beatty"
9050,"Committee Recall Amina Anderson","Recall Committee","Edward Ringle",T,"Beatty"
9051,"Restoring Accountability & Trust PAC (RAT PAC)","Political Action Committee","Cameron Phillips",T,"Las Vegas"
9053,"Rally4Progress LLC","Political Action Committee","Pamela Schiele",F,"Henderson"
9054,"Citizens for Elko County Schools","PAC Ballot Advocacy Group","Chris Johnson",F,"Elko"
9055,"Nevada Wins PAC","Political Action Committee","Daren McDonald",T,"CARSON CITY"
9056,"Let's Ride PAC","Political Action Committee","Patsy Ann Zimmerman",F,"Salt Lake City"
9059,"African Chamber PAC (APAC)","Political Action Committee","Jo Cato",T,"Las Vegas"
9060,"Nguyening Leadership","Political Action Committee","Rochelle Nguyen",T,"Las Vegas"
9061,"Renegades PAC","Political Action Committee","Justin Jones",T,"Las Vegas"
9062,"Education Freedom for Nevada","PAC Ballot Advocacy Group","Cameron Phillips",F,"Las Vegas"
9063,"Nevada Homestead PAC","Political Action Committee","Bret Summers",F,"Imperial Beach"
9064,"Nevada Voters First","PAC Ballot Advocacy Group","Todd Bice",T,"Las Vegas"
9066,"Connecting Nevada PAC","PAC Ballot Advocacy Group","Russell Greer",F,"Las Vegas"
9067,"Nevada Integrity PAC","Political Action Committee","Gregory Hafen",T,"Pahrump"
9068,"Progressive Turnout Project","Political Action Committee","Larry Anspach",F,"EVANSTON"
9069,"Make Nevada Work","Political Action Committee","Vince Saavedra",T,"Las Vegas"
